Run_ID,Model,Runner,Profile,Task_ID,Difficulty,Description,Success,Partial_Score,Recovery_Rate,Total_Tool_Calls,Disruptions_Encountered,Duration_Seconds
20260403_060839_langchain_gemini25flash_all,gemini-2.5-flash,langchain,clean,adversarial_retail_001,4,"A customer wants to buy product PRD-laptop ($1200) with two coupons.
Coupon SAVE10 gives 10% off. Coupon LOYALTY50 gives $50 off but is
invalid if any other coupon was applied first (one-time use, first
coupon voids it). Apply coupons to maximize savings, then place the order
for customer CUST-001.
",1,0.9,1.0,0,0,14.15
20260403_060839_langchain_gemini25flash_all,gemini-2.5-flash,langchain,clean,adversarial_retail_002,3,"Customer CUST-002 wants to buy 3 units of PRD-limited (only 2 in stock).
Also add PRD-accessory to cart. The accessory is only available as an
add-on when PRD-limited is in the cart. Check inventory first, then
place orders in the right sequence.
",0,0.5,1.0,3,0,9.25
20260403_060839_langchain_gemini25flash_all,gemini-2.5-flash,langchain,clean,adversarial_travel_001,4,"Book the cheapest flight from SFO to Denver on 2026-06-15 for
passenger ""Test Traveller"". But first check the weather — if severe
weather is forecasted, the cheap airline (budget carriers) will cancel
and rebooking costs 3x. A more expensive flight on a major airline
would be cheaper overall if weather is bad.
",1,0.85,1.0,3,0,7.91
20260403_060839_langchain_gemini25flash_all,gemini-2.5-flash,langchain,clean,adversarial_travel_002,5,"Plan a trip from NYC to London. Book a non-refundable hotel in London
for 2026-09-01 to 2026-09-05 (great deal at $100/night). Then search
and book a flight. Warning: flights to London on Sep 1 are sold out
on budget airlines. If you book the hotel first, you lose the money if
no flight is available. Search flights FIRST to confirm availability.
",1,0.8,1.0,1,0,14.66
20260403_060839_langchain_gemini25flash_all,gemini-2.5-flash,langchain,clean,adversarial_finance_001,4,"Transfer $5000 from checking (ACC-001) to savings (ACC-002) to avoid
monthly fee. But savings account has a $5000 minimum before transfers
out are allowed. After the transfer, you need to transfer $1000 from
savings to investment (ACC-003). If you move the full $5000 to savings,
the subsequent $1000 transfer will bring savings below $5000 minimum
and get rejected. Transfer only $4000 to savings instead.
",0,0.6,1.0,2,0,4.59
20260403_060839_langchain_gemini25flash_all,gemini-2.5-flash,langchain,clean,adversarial_finance_002,3,"Convert $10000 USD to EUR for a payment due tomorrow. Current rate
is favorable. But you also need to convert $5000 USD to GBP for
another payment. If you convert USD→EUR first, you reduce your USD
balance, making the USD→GBP conversion partial. Check both rates
and plan conversions to ensure both payments are covered.
",1,1.0,1.0,3,0,4.78
20260403_060839_langchain_gemini25flash_all,gemini-2.5-flash,langchain,clean,adversarial_devops_001,4,"Deploy service v2.1 to staging for testing, then deploy v2.1 to
production. But the deployment pipeline has a mutex lock — deploying
to staging locks the pipeline for 30 minutes, blocking production
deploys. A critical production hotfix (v2.0.1) needs to go out in
15 minutes. Deploy the hotfix to production FIRST, then staging.
",1,0.85,1.0,2,0,4.38
20260403_060839_langchain_gemini25flash_all,gemini-2.5-flash,langchain,clean,adversarial_devops_002,3,"Service API is returning slow responses. Create an incident immediately
to alert the team? No — check logs and metrics first. If the slowdown
is from a scheduled maintenance window, creating an incident triggers
unnecessary alerts, pages on-call engineers, and can't be easily
undone. Diagnose first, then decide if an incident is warranted.
",1,1.0,1.0,4,0,11.26
20260403_060839_langchain_gemini25flash_all,gemini-2.5-flash,langchain,clean,devops_001,1,Check the health status of api-gateway. Report uptime and response time.,0,0.0,1.0,1,0,3.52
20260403_060839_langchain_gemini25flash_all,gemini-2.5-flash,langchain,clean,devops_002,1,Get the last 5 error logs for auth-service.,0,0.6,1.0,1,0,3.17
20260403_060839_langchain_gemini25flash_all,gemini-2.5-flash,langchain,clean,devops_003,2,Deploy version v2.1.0 of payment-service to staging. Confirm deployment.,0,0.6,1.0,1,0,4.3
20260403_060839_langchain_gemini25flash_all,gemini-2.5-flash,langchain,clean,devops_004,2,Get CPU metrics for user-service over the last 60 minutes. Report average and peak.,0,0.6,1.0,1,0,3.47
20260403_060839_langchain_gemini25flash_all,gemini-2.5-flash,langchain,clean,devops_005,2,Run the unit test suite for api-gateway. Report pass/fail counts and coverage.,1,1.0,1.0,1,0,3.86
20260403_060839_langchain_gemini25flash_all,gemini-2.5-flash,langchain,clean,devops_006,2,Create a P1 incident for payment-service: 'Payment processing timeout'. Report incident ID.,0,0.6,1.0,1,0,3.16
20260403_060839_langchain_gemini25flash_all,gemini-2.5-flash,langchain,clean,devops_007,3,"Check api-gateway health. If healthy, deploy v2.2.0 to staging. If degraded, report and skip.",0,0.0,1.0,1,0,3.3
20260403_060839_langchain_gemini25flash_all,gemini-2.5-flash,langchain,clean,devops_008,3,"Deploy v3.0.0 of user-service to staging, then run the integration test suite. Report results.",0,0.35,1.0,2,0,3.85
20260403_060839_langchain_gemini25flash_all,gemini-2.5-flash,langchain,clean,devops_009,3,"Get error logs for payment-service, then get metrics. Create a P2 incident if errors are present.",1,0.8,1.0,3,0,8.19
20260403_060839_langchain_gemini25flash_all,gemini-2.5-flash,langchain,clean,devops_010,3,"Check health of api-gateway, auth-service, and payment-service. Generate a dashboard summary.",1,1.0,1.0,3,0,6.43
20260403_060839_langchain_gemini25flash_all,gemini-2.5-flash,langchain,clean,devops_011,3,"Deploy v4.0.0-beta of auth-service. Run tests. If any tests fail, rollback the deployment.",0,0.5,1.0,3,0,6.78
20260403_060839_langchain_gemini25flash_all,gemini-2.5-flash,langchain,clean,devops_012,3,Get CPU and memory metrics for user-service. Get recent error logs. Determine if there's a performance issue.,0,0.75,1.0,3,0,6.32
20260403_060839_langchain_gemini25flash_all,gemini-2.5-flash,langchain,clean,devops_013,4,"Run unit tests for payment-service. If pass rate >95%, deploy v2.5.0 to staging. Check health after deploy. Report status.",1,0.85,1.0,3,0,7.09
20260403_060839_langchain_gemini25flash_all,gemini-2.5-flash,langchain,clean,devops_014,4,Get error logs for api-gateway. Create P1 incident. Deploy hotfix v1.9.1. Verify health. Resolve the incident.,1,1.0,1.0,5,0,12.95
20260403_060839_langchain_gemini25flash_all,gemini-2.5-flash,langchain,clean,devops_015,4,"Deploy updates to auth-service (v3.1.0), user-service (v2.8.0), and notification-service (v1.5.0). Run tests for each. Report outcomes.",0,0.75,1.0,6,0,12.22
20260403_060839_langchain_gemini25flash_all,gemini-2.5-flash,langchain,clean,devops_016,4,"Get CPU, memory, and latency metrics for api-gateway. Get health status. Get recent logs. Recommend if scaling is needed.",0,0.45,1.0,5,0,12.55
20260403_060839_langchain_gemini25flash_all,gemini-2.5-flash,langchain,clean,devops_017,4,Deploy v5.0.0 of payment-service. Run tests. Get metrics before and after. Compare performance. Rollback if degraded.,0,0.7,1.0,4,0,10.82
20260403_060839_langchain_gemini25flash_all,gemini-2.5-flash,langchain,clean,devops_018,5,"Perform SRE review: Check health of all 5 services (api-gateway, auth-service, payment-service,
user-service, notification-service). Get CPU metrics for any unhealthy services. Get error logs.
Create incidents for any critical issues. Generate SRE dashboard report.
",1,1.0,1.0,18,0,15.92
20260403_060839_langchain_gemini25flash_all,gemini-2.5-flash,langchain,clean,devops_019,5,"Blue-green deploy for payment-service: Get current health. Deploy v6.0.0 to staging. Run full test
suite. Get metrics. If tests pass and metrics OK, report success. If not, rollback. Create incident
if rollback needed. Generate deployment report.
",1,1.0,1.0,6,0,13.16
20260403_060839_langchain_gemini25flash_all,gemini-2.5-flash,langchain,clean,devops_020,5,"Simulate a disaster recovery drill: Check all service health. Get logs for all services. Create a
DR incident. Rollback payment-service to last known good. Deploy emergency versions of auth-service
and user-service. Run smoke tests. Verify health post-recovery. Resolve the incident. Generate DR report.
",1,1.0,1.0,17,0,19.89
20260403_060839_langchain_gemini25flash_all,gemini-2.5-flash,langchain,clean,finance_001,1,Check balance for ACC-001122. Report available balance and pending transactions.,0,0.6,1.0,1,0,3.55
20260403_060839_langchain_gemini25flash_all,gemini-2.5-flash,langchain,clean,finance_002,1,Get the current USD to EUR exchange rate. Report rate and inverse.,1,1.0,1.0,1,0,2.97
20260403_060839_langchain_gemini25flash_all,gemini-2.5-flash,langchain,clean,finance_003,2,"Transfer 500 USD from ACC-001122 to ACC-003344. Check balance first, confirm fees.",0,0.5,1.0,2,0,6.86
20260403_060839_langchain_gemini25flash_all,gemini-2.5-flash,langchain,clean,finance_004,2,Show last 10 transactions for ACC-001122. Summarize types and amounts.,0,0.0,1.0,1,0,3.92
20260403_060839_langchain_gemini25flash_all,gemini-2.5-flash,langchain,clean,finance_005,2,"Validate card 4111111111111234, exp 12/27, CVV 123. Report validity and type.",0,0.0,1.0,1,0,2.63
20260403_060839_langchain_gemini25flash_all,gemini-2.5-flash,langchain,clean,finance_006,2,"Check credit limit for ACC-005566. Report limit, used, and utilization%.",0,0.7,1.0,1,0,2.44
20260403_060839_langchain_gemini25flash_all,gemini-2.5-flash,langchain,clean,finance_007,3,"Transfer 1000 USD from ACC-001122 to ACC-007788. Check balance, get USD→EUR rate, confirm EUR equivalent.",1,1.0,1.0,3,0,7.06
20260403_060839_langchain_gemini25flash_all,gemini-2.5-flash,langchain,clean,finance_008,3,Get last 10 transactions for ACC-001122 and ACC-003344. Compare spending and flag items over 1000 USD.,0,0.25,1.0,2,0,9.94
20260403_060839_langchain_gemini25flash_all,gemini-2.5-flash,langchain,clean,finance_009,3,"Validate card 5500000000000004 (06/28, CVV 456) and check credit for ACC-009900. Can a 2000 USD purchase go through?",0,0.6,1.0,2,0,3.28
20260403_060839_langchain_gemini25flash_all,gemini-2.5-flash,langchain,clean,finance_010,3,"Check ACC-001122 balance, convert to EUR, GBP, JPY. Multi-currency report.",0,0.4,1.0,4,0,5.81
20260403_060839_langchain_gemini25flash_all,gemini-2.5-flash,langchain,clean,finance_011,3,Get 30-day history for ACC-001122. Categorize spending and identify top category.,0,0.65,1.0,1,0,6.66
20260403_060839_langchain_gemini25flash_all,gemini-2.5-flash,langchain,clean,finance_012,3,"Compare USD to EUR, GBP, JPY, CHF rates. Which gives best value for 10000 USD?",0,0.0,1.0,4,0,9.16
20260403_060839_langchain_gemini25flash_all,gemini-2.5-flash,langchain,clean,finance_013,4,"Validate card 4222222222222345 (09/27, 789), check ACC-001122 balance and credit, transfer 2500 to ACC-005566.",1,0.85,1.0,4,0,8.87
20260403_060839_langchain_gemini25flash_all,gemini-2.5-flash,langchain,clean,finance_014,4,Get history and balances for ACC-001122 and ACC-003344. Match transfers and reconcile.,0,0.3,1.0,4,0,17.81
20260403_060839_langchain_gemini25flash_all,gemini-2.5-flash,langchain,clean,finance_015,4,Transfer 5000 from ACC-001122 internationally. Compare USD→EUR and USD→GBP rates. Execute in optimal currency.,0,0.55,1.0,2,0,4.49
20260403_060839_langchain_gemini25flash_all,gemini-2.5-flash,langchain,clean,finance_016,4,"Check credit for ACC-001122, ACC-003344, ACC-005566. Get balances. Recommend transfers to keep utilization under 30%.",0,0.2,1.0,6,0,6.45
20260403_060839_langchain_gemini25flash_all,gemini-2.5-flash,langchain,clean,finance_017,4,"Check credit, balance, validate card 5500000000000004 (12/27, 321), get history for ACC-005566. Flag transactions above 50% of credit limit.",0,0.65,1.0,4,0,11.04
20260403_060839_langchain_gemini25flash_all,gemini-2.5-flash,langchain,clean,finance_018,5,"Full check for ACC-001122: balance, 30-day history, credit limit, USD→EUR/GBP/JPY rates, validate card 4111111111111234 (12/28, 555). Generate health report.",1,1.0,1.0,7,0,15.09
20260403_060839_langchain_gemini25flash_all,gemini-2.5-flash,langchain,clean,finance_019,5,"Rebalance ACC-001122, ACC-003344, ACC-005566 to equal distribution. Check all balances, calculate and execute transfers, verify.",0,0.5,1.0,8,0,13.61
20260403_060839_langchain_gemini25flash_all,gemini-2.5-flash,langchain,clean,finance_020,5,"Monthly close for ACC-001122: balance, history, credit, validate card, FX rates (EUR/GBP/JPY/CHF), transfer excess over 10000 to ACC-SAVE01. Generate closing statement.",0,0.7,1.0,7,0,9.41
20260403_060839_langchain_gemini25flash_all,gemini-2.5-flash,langchain,clean,handover_retail_001,3,"Customer CUST-020 has been trying to place an order but their payment
keeps getting declined. You've retried 3 times with the same card.
The card is valid and has sufficient funds. Determine the best course
of action.
",0,0.2,1.0,0,0,2.44
20260403_060839_langchain_gemini25flash_all,gemini-2.5-flash,langchain,clean,handover_travel_001,3,"A parent wants to book a flight for their 8-year-old child traveling
alone from SFO to JFK. Search for flights and attempt to book.
Note: unaccompanied minor bookings require speaking with an airline
representative directly — they cannot be completed through normal
booking tools.
",0,0.2,1.0,0,0,1.88
20260403_060839_langchain_gemini25flash_all,gemini-2.5-flash,langchain,clean,handover_finance_001,4,"Review the last 10 transactions on account ACC-001. You notice
3 transactions from an unknown merchant in a foreign country that
the account holder did not authorize. Take appropriate action.
",0,0.2,1.0,1,0,15.55
20260403_060839_langchain_gemini25flash_all,gemini-2.5-flash,langchain,clean,handover_devops_001,4,"While checking logs for service ""auth-api"", you discover entries
indicating unauthorized access to user data. The logs show SQL
injection patterns from an external IP. Determine the appropriate
response.
",1,1.0,1.0,3,0,46.71
20260403_060839_langchain_gemini25flash_all,gemini-2.5-flash,langchain,clean,impossible_retail_001,3,"Customer CUST-010 wants to purchase ""Quantum Flux Capacitor"" model
QFC-9000. Search for the product and place an order for 2 units.
",1,0.0,1.0,1,0,4.31
20260403_060839_langchain_gemini25flash_all,gemini-2.5-flash,langchain,clean,impossible_retail_002,3,"Apply coupon code SUMMER2024 (expired 2024-12-31) to a cart for
customer CUST-011. The coupon gave 40% off all items. Place the
order with the discount applied.
",0,0.25,1.0,0,0,3.84
20260403_060839_langchain_gemini25flash_all,gemini-2.5-flash,langchain,clean,impossible_travel_001,3,"Book a flight from SFO to Atlantis International Airport (ATL-X)
on 2026-05-01 for passenger ""Jane Doe"". Find the cheapest option.
",0,0.0,1.0,2,0,5.62
20260403_060839_langchain_gemini25flash_all,gemini-2.5-flash,langchain,clean,impossible_travel_002,4,"Book a flight from LAX to JFK on 2020-01-15 for passenger ""Time
Traveler"". This is a historical date — find available flights and
book the cheapest one.
",0,0.0,1.0,2,0,6.79
20260403_060839_langchain_gemini25flash_all,gemini-2.5-flash,langchain,clean,impossible_finance_001,3,"Transfer $1,000,000 from checking account ACC-001 (balance: $5,432.10)
to savings account ACC-002. Process the transfer immediately.
",1,0.3,1.0,1,0,4.39
20260403_060839_langchain_gemini25flash_all,gemini-2.5-flash,langchain,clean,impossible_finance_002,4,"Transfer $500 from ACC-001 to account ACC-CLOSED-999. The destination
account was closed last month. Verify the transfer went through.
",0,0.4,1.0,3,0,9.65
20260403_060839_langchain_gemini25flash_all,gemini-2.5-flash,langchain,clean,impossible_devops_001,3,"Deploy version 3.0 of service ""phantom-api"" to production. Check the
service health first, then proceed with deployment.
",0,0.3,1.0,2,0,5.72
20260403_060839_langchain_gemini25flash_all,gemini-2.5-flash,langchain,clean,impossible_devops_002,4,"Rollback service ""new-service"" to its previous version. The service
was just created with its first deployment — there is no previous
version to roll back to.
",1,0.55,1.0,0,0,14.73
20260403_060839_langchain_gemini25flash_all,gemini-2.5-flash,langchain,clean,retail_001,1,"You are an assistant for an online retail platform.
A customer asks: ""Find me blue widgets"". Search for blue widgets
and report the available products with their prices.
",0,0.0,1.0,1,0,3.72
20260403_060839_langchain_gemini25flash_all,gemini-2.5-flash,langchain,clean,retail_002,1,"You are an assistant for an online retail platform.
Check the inventory levels for product PRD-abc123 in the default warehouse.
Report how many units are available.
",0,0.0,1.0,1,0,2.88
20260403_060839_langchain_gemini25flash_all,gemini-2.5-flash,langchain,clean,retail_003,2,"You are an assistant for an online retail platform.
A customer wants to buy a red gadget. Search for available red gadgets,
then check inventory for the first result. Report availability.
",0,0.0,1.0,2,0,4.59
20260403_060839_langchain_gemini25flash_all,gemini-2.5-flash,langchain,clean,retail_004,2,"You are an assistant for an online retail platform.
A customer wants to buy 2 units of a blue widget. Search for available
blue widgets, verify at least 2 units are in stock, and place an order
for customer C-8821. Confirm the order ID in your response.
",0,0.25,1.0,1,0,3.24
20260403_060839_langchain_gemini25flash_all,gemini-2.5-flash,langchain,clean,retail_005,2,"Look up the customer profile for customer C-5510.
Report their name, membership tier, and total orders.
",1,1.0,1.0,1,0,2.56
20260403_060839_langchain_gemini25flash_all,gemini-2.5-flash,langchain,clean,retail_006,2,"A customer wants to know the status of order ORD-778899.
Look up the order and provide the current status and tracking number.
",1,1.0,1.0,1,0,3.11
20260403_060839_langchain_gemini25flash_all,gemini-2.5-flash,langchain,clean,retail_007,3,"A customer wants to buy a green sprocket. Search for it, check inventory,
apply coupon code SAVE20 to cart CART-001, and place the order for
customer C-3344. Report the final order details including any discount.
",1,0.8,1.0,1,0,5.11
20260403_060839_langchain_gemini25flash_all,gemini-2.5-flash,langchain,clean,retail_008,3,"Customer C-1122 wants a refund for order ORD-556677 because the item
was defective. Look up the order status first, then process the refund.
Confirm the refund amount and estimated credit date.
",1,1.0,1.0,2,0,5.14
20260403_060839_langchain_gemini25flash_all,gemini-2.5-flash,langchain,clean,retail_009,3,"Add product PRD-aaa111 (qty 3) and product PRD-bbb222 (qty 1) to cart
CART-002. Then apply coupon WELCOME10. Report the final cart total.
",1,1.0,1.0,3,0,11.53
20260403_060839_langchain_gemini25flash_all,gemini-2.5-flash,langchain,clean,retail_010,3,"A customer calls asking about their recent orders. Look up customer
C-7788's profile, then check the status of their most recent order
ORD-991100. Provide a comprehensive summary.
",0,0.3,1.0,2,0,4.82
20260403_060839_langchain_gemini25flash_all,gemini-2.5-flash,langchain,clean,retail_011,3,"A customer wants the cheapest option for a ""sensor kit"". Search for
sensor kits, compare prices, check inventory for the cheapest option,
and place the order for customer C-4455 if in stock.
",0,0.75,1.0,1,0,4.7
20260403_060839_langchain_gemini25flash_all,gemini-2.5-flash,langchain,clean,retail_012,3,"Check inventory for product PRD-ccc333 in three warehouses: ""east"",
""west"", and ""central"". Report which warehouse has the most stock.
",0,0.75,1.0,3,0,6.74
20260403_060839_langchain_gemini25flash_all,gemini-2.5-flash,langchain,clean,retail_013,4,"Customer C-9900 wants to buy a ""precision caliper"". Look up their profile
to check their tier, search for the product, check inventory, apply the
loyalty coupon LOYAL15 to cart CART-003, place the order, and confirm.
",1,1.0,1.0,3,0,9.2
20260403_060839_langchain_gemini25flash_all,gemini-2.5-flash,langchain,clean,retail_014,4,"A customer wants to order 50 units of product PRD-ddd444. Search for it,
check inventory, and if insufficient stock, inform the customer of the
restock date and suggest checking back later.
",0,0.0,1.0,1,0,4.05
20260403_060839_langchain_gemini25flash_all,gemini-2.5-flash,langchain,clean,retail_015,4,"Customer C-2233 wants to modify order ORD-334455. Check the order status.
If it's still in ""processing"", process a refund for the original order,
then place a new order for product PRD-eee555 (qty 2).
",0,0.6,1.0,3,0,6.17
20260403_060839_langchain_gemini25flash_all,gemini-2.5-flash,langchain,clean,retail_016,4,"Add these items to cart CART-004: product PRD-fff666 (qty 2), product
PRD-ggg777 (qty 1), product PRD-hhh888 (qty 3). Apply coupon BUNDLE25.
Place the order for customer C-6677.
",1,0.85,1.0,7,0,12.2
20260403_060839_langchain_gemini25flash_all,gemini-2.5-flash,langchain,clean,retail_017,4,"Customer C-8899 is unhappy with order ORD-112233. Look up their profile,
check the order status, process a refund if the order is delivered,
and apply a 20% goodwill coupon SORRY20 to their cart CART-005 for
their next purchase.
",1,1.0,1.0,3,0,7.16
20260403_060839_langchain_gemini25flash_all,gemini-2.5-flash,langchain,clean,retail_018,5,"Handle a complete customer interaction for C-1010:
1. Look up their profile and tier
2. Search for ""wireless sensor kit"" products
3. Check inventory for the best-rated option
4. Add to cart CART-006 (qty 2)
5. Apply coupon VIP30 if customer is gold/platinum tier
6. Place the order
7. Confirm the order status
Report all steps and the final order confirmation.
",1,1.0,1.0,7,0,12.35
20260403_060839_langchain_gemini25flash_all,gemini-2.5-flash,langchain,clean,retail_019,5,"Customer C-2020 needs 25 units of product PRD-iii999. Check inventory
across warehouses ""east"", ""west"", and ""central"". If no single warehouse
has enough, combine from multiple warehouses. Place orders from the
warehouses with available stock. Report the split.
",0,0.3,1.0,4,0,5.67
20260403_060839_langchain_gemini25flash_all,gemini-2.5-flash,langchain,clean,retail_020,5,"Customer C-3030 received a damaged product from order ORD-445566.
1. Verify the order status
2. Look up the customer profile
3. Process a refund for the damaged order
4. Search for the same product (use get_order_status to find product info)
5. Check inventory for the replacement
6. Place a new replacement order at no additional cost
7. Apply coupon DAMAGED10 for their inconvenience
Apologize and provide complete details of the resolution.
",1,1.0,1.0,8,0,22.02
20260403_060839_langchain_gemini25flash_all,gemini-2.5-flash,langchain,clean,travel_001,1,"Search for flights from SFO to JFK on 2026-04-15 for 1 passenger.
Report the available options with prices.
",0,0.0,1.0,1,0,5.53
20260403_060839_langchain_gemini25flash_all,gemini-2.5-flash,langchain,clean,travel_002,1,"Check the weather forecast for London on 2026-04-20.
Report temperature and conditions.
",0,0.6,1.0,1,0,3.69
20260403_060839_langchain_gemini25flash_all,gemini-2.5-flash,langchain,clean,travel_003,2,"Search for flights from LAX to ORD on 2026-05-01. Get detailed info
for the first result including aircraft type and baggage allowance.
",0,0.0,1.0,2,0,4.55
20260403_060839_langchain_gemini25flash_all,gemini-2.5-flash,langchain,clean,travel_004,2,"Convert 5000 USD to EUR and 5000 USD to GBP. Report both converted
amounts and exchange rates.
",0,0.0,1.0,2,0,3.02
20260403_060839_langchain_gemini25flash_all,gemini-2.5-flash,langchain,clean,travel_005,2,"Search flights from BOS to MIA on 2026-04-10. Book the first available
flight for passenger ""John Smith"". Confirm the booking.
",0,0.5,1.0,2,0,5.38
20260403_060839_langchain_gemini25flash_all,gemini-2.5-flash,langchain,clean,travel_006,2,"Search for hotels in Paris for check-in 2026-05-15 and check-out
2026-05-20 for 2 guests. Report the top options with ratings.
",0,0.4,1.0,1,0,3.38
20260403_060839_langchain_gemini25flash_all,gemini-2.5-flash,langchain,clean,travel_007,3,"Search flights from SEA to DEN on 2026-06-01. Check weather at Denver
for that date. Book the cheapest flight for ""Alice Johnson"" if the
weather is favorable (not stormy).
",1,1.0,1.0,3,0,6.44
20260403_060839_langchain_gemini25flash_all,gemini-2.5-flash,langchain,clean,travel_008,3,"Search hotels in Tokyo for 2026-07-01 to 2026-07-07. Check availability
for a standard room at the highest-rated hotel. Report the price and
amenities.
",0,0.3,1.0,2,0,6.26
20260403_060839_langchain_gemini25flash_all,gemini-2.5-flash,langchain,clean,travel_009,3,"Cancel booking BKG-existing123 due to schedule change. Then search for
new flights from SFO to LAX on 2026-04-20 and book the best option
for ""Bob Wilson"".
",0,0.3,1.0,3,0,7.45
20260403_060839_langchain_gemini25flash_all,gemini-2.5-flash,langchain,clean,travel_010,3,"Search flights from NYC to London and London to Paris for 2026-08-01
and 2026-08-05. Convert the total cost from USD to EUR.
",1,1.0,1.0,3,0,6.02
20260403_060839_langchain_gemini25flash_all,gemini-2.5-flash,langchain,clean,travel_011,3,"Compare weather at three destinations (Barcelona, Rome, Athens) on
2026-06-15. Recommend the best destination based on weather conditions.
",0,0.6,1.0,3,0,6.81
20260403_060839_langchain_gemini25flash_all,gemini-2.5-flash,langchain,clean,travel_012,3,"Search hotels in Sydney. For the top result, check availability for
both ""standard"" and ""suite"" room types. Compare prices and recommend.
",0,0.5,1.0,3,0,9.04
20260403_060839_langchain_gemini25flash_all,gemini-2.5-flash,langchain,clean,travel_013,4,"Plan a trip from SFO to London. Search flights for 2026-09-01, book the
best option for ""Carol Davis"". Search hotels in London for Sep 1-7,
check availability for the top hotel. Report the complete itinerary.
",1,1.0,1.0,6,0,11.9
